<?xml version='1.0' encoding='us-ascii'?>
<!DOCTYPE PathAnalysisResults [
<!ELEMENT PathAnalysisResults (Routing*,Path*,ExecutionDescription?)>
<!ELEMENT Path (PathEndpoint+, PathPoint*,Match*,PathDescription?)>
<!ATTLIST Path pathNumber CDATA #REQUIRED>
<!ATTLIST Path pathSet CDATA #IMPLIED>
<!ATTLIST Path connectionCode CDATA #IMPLIED>
<!ATTLIST Path protocol CDATA #REQUIRED>
<!ATTLIST Path signature CDATA #IMPLIED>
<!ELEMENT PathEndpoint (IPRange+, PortRange+, PathHost*)>
<!ATTLIST PathEndpoint Id CDATA #REQUIRED>
<!ATTLIST PathEndpoint type (begin|end) #REQUIRED>
<!ELEMENT IPRange EMPTY>
<!ATTLIST IPRange first CDATA #REQUIRED>
<!ATTLIST IPRange last  CDATA #REQUIRED>
<!ATTLIST IPRange include  CDATA #IMPLIED>
<!ELEMENT PathHost EMPTY>
<!ATTLIST PathHost Id CDATA #REQUIRED>
<!ELEMENT PortRange EMPTY>
<!ATTLIST PortRange first CDATA #REQUIRED>
<!ATTLIST PortRange last CDATA #REQUIRED>
<!ELEMENT PathPoint (PathRule*)>
<!ATTLIST PathPoint Id CDATA #REQUIRED>
<!ATTLIST PathPoint Ingress CDATA #IMPLIED>
<!ATTLIST PathPoint Egress CDATA #IMPLIED>
<!ELEMENT PathRule EMPTY>
<!ATTLIST PathRule sequence CDATA #REQUIRED>
<!ELEMENT Match (Pattern*)>
<!ATTLIST Match matchType (include|exclude|exhaustive) #REQUIRED>
<!ELEMENT Pattern EMPTY>
<!ATTLIST Pattern Id CDATA #REQUIRED>
<!ELEMENT PathDescription EMPTY>
<!ATTLIST PathDescription text CDATA #REQUIRED>
<!ATTLIST PathDescription service CDATA #REQUIRED>
<!ELEMENT ExecutionDescription (ExecutionParameter+)>
<!ELEMENT ExecutionParameter EMPTY>
<!ATTLIST ExecutionParameter flag CDATA #REQUIRED>
<!ATTLIST ExecutionParameter value CDATA #REQUIRED>
<!ELEMENT Routing EMPTY>
<!ATTLIST Routing sequence CDATA #REQUIRED>
<!ATTLIST Routing description CDATA #REQUIRED>
]>
<PathAnalysisResults>

<Routing sequence="r1" description="(std)  Default route -> outside"></Routing>
<Routing sequence="r2" description="(std) Forward through interface chosen by simulated ospf"></Routing>
<Routing sequence="r56" description="(std) 10.1.1.0-10.1.1.255 -> outside (no gw specified)"></Routing>
<Routing sequence="r57" description="(std) 10.37.1.0-10.37.1.255 -> inside (no gw specified)"></Routing>
<Routing sequence="r3" description="(implicit ACL) Forward through interface suggested by ACL rule"></Routing>
<Routing sequence="r4" description="(implicit NAT) Forward through interface suggested by NAT rule"></Routing>
<Routing sequence="r6" description="(std)  Default route -> outside"></Routing>
<Routing sequence="r7" description="(std) Forward through interface chosen by simulated ospf"></Routing>
<Routing sequence="r11" description="(std) 72.0.0.0-72.255.255.255 -> outside (72.36.82.1)"></Routing>
<Routing sequence="r12" description="(std) 192.17.0.0-192.17.255.255 -> outside (72.36.82.1)"></Routing>
<Routing sequence="r13" description="(std) 10.31.1.0-10.31.1.255 -> inside (10.1.1.9)"></Routing>
<Routing sequence="r14" description="(std) 10.32.1.0-10.32.1.255 -> inside (10.1.1.2)"></Routing>
<Routing sequence="r15" description="(std) 10.33.1.0-10.33.1.255 -> inside (10.1.1.3)"></Routing>
<Routing sequence="r16" description="(std) 10.34.1.0-10.34.1.255 -> inside (10.1.1.4)"></Routing>
<Routing sequence="r17" description="(std) 10.35.1.0-10.35.1.255 -> inside (10.1.1.5)"></Routing>
<Routing sequence="r18" description="(std) 10.36.1.0-10.36.1.255 -> inside (10.1.1.7)"></Routing>
<Routing sequence="r19" description="(std) 10.37.1.0-10.37.1.255 -> inside (10.1.1.7)"></Routing>
<Routing sequence="r20" description="(std) 10.38.1.0-10.38.1.255 -> inside (10.1.1.8)"></Routing>
<Routing sequence="r58" description="(std) 72.36.82.0-72.36.82.255 -> outside (no gw specified)"></Routing>
<Routing sequence="r59" description="(std) 10.1.1.0-10.1.1.255 -> inside (no gw specified)"></Routing>
<Routing sequence="r60" description="(std) 10.39.1.0-10.39.1.255 -> dmz (no gw specified)"></Routing>
<Routing sequence="r8" description="(implicit ACL) Forward through interface suggested by ACL rule"></Routing>
<Routing sequence="r9" description="(implicit NAT) Forward through interface suggested by NAT rule"></Routing>
<Routing sequence="r21" description="(std)  Default route -> outside"></Routing>
<Routing sequence="r22" description="(std) Forward through interface chosen by simulated ospf"></Routing>
<Routing sequence="r61" description="(std) 10.31.1.0-10.31.1.255 -> inside (no gw specified)"></Routing>
<Routing sequence="r62" description="(std) 10.1.1.0-10.1.1.255 -> outside (no gw specified)"></Routing>
<Routing sequence="r23" description="(implicit ACL) Forward through interface suggested by ACL rule"></Routing>
<Routing sequence="r24" description="(implicit NAT) Forward through interface suggested by NAT rule"></Routing>
<Routing sequence="r26" description="(std)  Default route -> outside"></Routing>
<Routing sequence="r27" description="(std) Forward through interface chosen by simulated ospf"></Routing>
<Routing sequence="r63" description="(std) 10.32.1.0-10.32.1.255 -> inside (no gw specified)"></Routing>
<Routing sequence="r64" description="(std) 10.1.1.0-10.1.1.255 -> outside (no gw specified)"></Routing>
<Routing sequence="r28" description="(implicit ACL) Forward through interface suggested by ACL rule"></Routing>
<Routing sequence="r29" description="(implicit NAT) Forward through interface suggested by NAT rule"></Routing>
<Routing sequence="r31" description="(std)  Default route -> outside"></Routing>
<Routing sequence="r32" description="(std) Forward through interface chosen by simulated ospf"></Routing>
<Routing sequence="r65" description="(std) 10.1.1.0-10.1.1.255 -> outside (no gw specified)"></Routing>
<Routing sequence="r66" description="(std) 10.33.1.0-10.33.1.255 -> inside (no gw specified)"></Routing>
<Routing sequence="r33" description="(implicit ACL) Forward through interface suggested by ACL rule"></Routing>
<Routing sequence="r34" description="(implicit NAT) Forward through interface suggested by NAT rule"></Routing>
<Routing sequence="r36" description="(std)  Default route -> outside"></Routing>
<Routing sequence="r37" description="(std) Forward through interface chosen by simulated ospf"></Routing>
<Routing sequence="r67" description="(std) 10.1.1.0-10.1.1.255 -> outside (no gw specified)"></Routing>
<Routing sequence="r68" description="(std) 10.34.1.0-10.34.1.255 -> inside (no gw specified)"></Routing>
<Routing sequence="r38" description="(implicit ACL) Forward through interface suggested by ACL rule"></Routing>
<Routing sequence="r39" description="(implicit NAT) Forward through interface suggested by NAT rule"></Routing>
<Routing sequence="r41" description="(std)  Default route -> outside"></Routing>
<Routing sequence="r42" description="(std) Forward through interface chosen by simulated ospf"></Routing>
<Routing sequence="r69" description="(std) 10.1.1.0-10.1.1.255 -> outside (no gw specified)"></Routing>
<Routing sequence="r70" description="(std) 10.35.1.0-10.35.1.255 -> inside (no gw specified)"></Routing>
<Routing sequence="r43" description="(implicit ACL) Forward through interface suggested by ACL rule"></Routing>
<Routing sequence="r44" description="(implicit NAT) Forward through interface suggested by NAT rule"></Routing>
<Routing sequence="r46" description="(std)  Default route -> outside"></Routing>
<Routing sequence="r47" description="(std) Forward through interface chosen by simulated ospf"></Routing>
<Routing sequence="r71" description="(std) 10.1.1.0-10.1.1.255 -> outside (no gw specified)"></Routing>
<Routing sequence="r72" description="(std) 10.36.1.0-10.36.1.255 -> inside (no gw specified)"></Routing>
<Routing sequence="r48" description="(implicit ACL) Forward through interface suggested by ACL rule"></Routing>
<Routing sequence="r49" description="(implicit NAT) Forward through interface suggested by NAT rule"></Routing>
<Routing sequence="r51" description="(std)  Default route -> outside"></Routing>
<Routing sequence="r52" description="(std) Forward through interface chosen by simulated ospf"></Routing>
<Routing sequence="r73" description="(std) 10.1.1.0-10.1.1.255 -> outside (no gw specified)"></Routing>
<Routing sequence="r74" description="(std) 10.38.1.0-10.38.1.255 -> inside (no gw specified)"></Routing>
<Routing sequence="r53" description="(implicit ACL) Forward through interface suggested by ACL rule"></Routing>
<Routing sequence="r54" description="(implicit NAT) Forward through interface suggested by NAT rule"></Routing>

<Path pathNumber="1" pathSet="107" connectionCode = "1881%1876" protocol="tcp">
<PathEndpoint type="begin" Id="1881">
	<IPRange first="0.0.0.0" last="10.1.0.255"/>
	<PortRange first="0" last="65535"/>
</PathEndpoint>
<PathEndpoint type="end" Id="1876">
	<IPRange first="10.39.1.22" last="10.39.1.22" include="1896"/>
	<PortRange first="22" last="22"/>
</PathEndpoint>
<PathPoint Id="1881">
</PathPoint>
<PathPoint Id="2028">
</PathPoint>
<PathPoint Id="1875">
</PathPoint>
<PathPoint Id="553" Ingress="outside" Egress="dmz">
	<PathRule sequence="r60"/>
	<PathRule sequence="15"/>
</PathPoint>
<PathPoint Id="1876">
</PathPoint>
<PathDescription text="" service=""/>
</Path>

<Path pathNumber="2" pathSet="107" connectionCode = "1881%1876" protocol="tcp">
<PathEndpoint type="begin" Id="1881">
	<IPRange first="70.32.128.23" last="70.32.128.73"/>
	<PortRange first="0" last="65535"/>
</PathEndpoint>
<PathEndpoint type="end" Id="1876">
	<IPRange first="10.39.1.22" last="10.39.1.22" include="1896"/>
	<PortRange first="22" last="22"/>
</PathEndpoint>
<PathPoint Id="1881">
</PathPoint>
<PathPoint Id="2028">
</PathPoint>
<PathPoint Id="1875">
</PathPoint>
<PathPoint Id="553" Ingress="outside" Egress="dmz">
	<PathRule sequence="r60"/>
	<PathRule sequence="15"/>
</PathPoint>
<PathPoint Id="1876">
</PathPoint>
<PathDescription text="" service=""/>
</Path>

<Path pathNumber="3" pathSet="107" connectionCode = "1881%1876" protocol="tcp">
<PathEndpoint type="begin" Id="1881">
	<IPRange first="70.32.128.75" last="70.32.128.170"/>
	<PortRange first="0" last="65535"/>
</PathEndpoint>
<PathEndpoint type="end" Id="1876">
	<IPRange first="10.39.1.22" last="10.39.1.22" include="1896"/>
	<PortRange first="22" last="22"/>
</PathEndpoint>
<PathPoint Id="1881">
</PathPoint>
<PathPoint Id="2028">
</PathPoint>
<PathPoint Id="1875">
</PathPoint>
<PathPoint Id="553" Ingress="outside" Egress="dmz">
	<PathRule sequence="r60"/>
	<PathRule sequence="15"/>
</PathPoint>
<PathPoint Id="1876">
</PathPoint>
<PathDescription text="" service=""/>
</Path>

<Path pathNumber="4" pathSet="107" connectionCode = "1881%1876" protocol="tcp">
<PathEndpoint type="begin" Id="1881">
	<IPRange first="70.32.128.172" last="71.255.255.255"/>
	<PortRange first="0" last="65535"/>
</PathEndpoint>
<PathEndpoint type="end" Id="1876">
	<IPRange first="10.39.1.22" last="10.39.1.22" include="1896"/>
	<PortRange first="22" last="22"/>
</PathEndpoint>
<PathPoint Id="1881">
</PathPoint>
<PathPoint Id="2028">
</PathPoint>
<PathPoint Id="1875">
</PathPoint>
<PathPoint Id="553" Ingress="outside" Egress="dmz">
	<PathRule sequence="r60"/>
	<PathRule sequence="15"/>
</PathPoint>
<PathPoint Id="1876">
</PathPoint>
<PathDescription text="" service=""/>
</Path>

<Path pathNumber="5" pathSet="107" connectionCode = "1881%1876" protocol="tcp">
<PathEndpoint type="begin" Id="1881">
	<IPRange first="73.0.0.0" last="192.16.255.255"/>
	<PortRange first="0" last="65535"/>
</PathEndpoint>
<PathEndpoint type="end" Id="1876">
	<IPRange first="10.39.1.22" last="10.39.1.22" include="1896"/>
	<PortRange first="22" last="22"/>
</PathEndpoint>
<PathPoint Id="1881">
</PathPoint>
<PathPoint Id="2028">
</PathPoint>
<PathPoint Id="1875">
</PathPoint>
<PathPoint Id="553" Ingress="outside" Egress="dmz">
	<PathRule sequence="r60"/>
	<PathRule sequence="15"/>
</PathPoint>
<PathPoint Id="1876">
</PathPoint>
<PathDescription text="" service=""/>
</Path>

<Path pathNumber="6" pathSet="107" connectionCode = "1881%1876" protocol="tcp">
<PathEndpoint type="begin" Id="1881">
	<IPRange first="10.1.2.0" last="10.31.0.255"/>
	<PortRange first="0" last="65535"/>
</PathEndpoint>
<PathEndpoint type="end" Id="1876">
	<IPRange first="10.39.1.22" last="10.39.1.22" include="1896"/>
	<PortRange first="22" last="22"/>
</PathEndpoint>
<PathPoint Id="1881">
</PathPoint>
<PathPoint Id="2028">
</PathPoint>
<PathPoint Id="1875">
</PathPoint>
<PathPoint Id="553" Ingress="outside" Egress="dmz">
	<PathRule sequence="r60"/>
	<PathRule sequence="15"/>
</PathPoint>
<PathPoint Id="1876">
</PathPoint>
<PathDescription text="" service=""/>
</Path>

<Path pathNumber="7" pathSet="107" connectionCode = "1881%1876" protocol="tcp">
<PathEndpoint type="begin" Id="1881">
	<IPRange first="10.31.2.0" last="10.32.0.255"/>
	<PortRange first="0" last="65535"/>
</PathEndpoint>
<PathEndpoint type="end" Id="1876">
	<IPRange first="10.39.1.22" last="10.39.1.22" include="1896"/>
	<PortRange first="22" last="22"/>
</PathEndpoint>
<PathPoint Id="1881">
</PathPoint>
<PathPoint Id="2028">
</PathPoint>
<PathPoint Id="1875">
</PathPoint>
<PathPoint Id="553" Ingress="outside" Egress="dmz">
	<PathRule sequence="r60"/>
	<PathRule sequence="15"/>
</PathPoint>
<PathPoint Id="1876">
</PathPoint>
<PathDescription text="" service=""/>
</Path>

<Path pathNumber="8" pathSet="107" connectionCode = "1881%1876" protocol="tcp">
<PathEndpoint type="begin" Id="1881">
	<IPRange first="10.32.2.0" last="10.33.0.255"/>
	<PortRange first="0" last="65535"/>
</PathEndpoint>
<PathEndpoint type="end" Id="1876">
	<IPRange first="10.39.1.22" last="10.39.1.22" include="1896"/>
	<PortRange first="22" last="22"/>
</PathEndpoint>
<PathPoint Id="1881">
</PathPoint>
<PathPoint Id="2028">
</PathPoint>
<PathPoint Id="1875">
</PathPoint>
<PathPoint Id="553" Ingress="outside" Egress="dmz">
	<PathRule sequence="r60"/>
	<PathRule sequence="15"/>
</PathPoint>
<PathPoint Id="1876">
</PathPoint>
<PathDescription text="" service=""/>
</Path>

<Path pathNumber="9" pathSet="107" connectionCode = "1881%1876" protocol="tcp">
<PathEndpoint type="begin" Id="1881">
	<IPRange first="10.33.2.0" last="10.34.0.255"/>
	<PortRange first="0" last="65535"/>
</PathEndpoint>
<PathEndpoint type="end" Id="1876">
	<IPRange first="10.39.1.22" last="10.39.1.22" include="1896"/>
	<PortRange first="22" last="22"/>
</PathEndpoint>
<PathPoint Id="1881">
</PathPoint>
<PathPoint Id="2028">
</PathPoint>
<PathPoint Id="1875">
</PathPoint>
<PathPoint Id="553" Ingress="outside" Egress="dmz">
	<PathRule sequence="r60"/>
	<PathRule sequence="15"/>
</PathPoint>
<PathPoint Id="1876">
</PathPoint>
<PathDescription text="" service=""/>
</Path>

<Path pathNumber="10" pathSet="107" connectionCode = "1881%1876" protocol="tcp">
<PathEndpoint type="begin" Id="1881">
	<IPRange first="10.34.2.0" last="10.35.0.255"/>
	<PortRange first="0" last="65535"/>
</PathEndpoint>
<PathEndpoint type="end" Id="1876">
	<IPRange first="10.39.1.22" last="10.39.1.22" include="1896"/>
	<PortRange first="22" last="22"/>
</PathEndpoint>
<PathPoint Id="1881">
</PathPoint>
<PathPoint Id="2028">
</PathPoint>
<PathPoint Id="1875">
</PathPoint>
<PathPoint Id="553" Ingress="outside" Egress="dmz">
	<PathRule sequence="r60"/>
	<PathRule sequence="15"/>
</PathPoint>
<PathPoint Id="1876">
</PathPoint>
<PathDescription text="" service=""/>
</Path>

<Path pathNumber="11" pathSet="107" connectionCode = "1881%1876" protocol="tcp">
<PathEndpoint type="begin" Id="1881">
	<IPRange first="10.35.2.0" last="10.36.0.255"/>
	<PortRange first="0" last="65535"/>
</PathEndpoint>
<PathEndpoint type="end" Id="1876">
	<IPRange first="10.39.1.22" last="10.39.1.22" include="1896"/>
	<PortRange first="22" last="22"/>
</PathEndpoint>
<PathPoint Id="1881">
</PathPoint>
<PathPoint Id="2028">
</PathPoint>
<PathPoint Id="1875">
</PathPoint>
<PathPoint Id="553" Ingress="outside" Egress="dmz">
	<PathRule sequence="r60"/>
	<PathRule sequence="15"/>
</PathPoint>
<PathPoint Id="1876">
</PathPoint>
<PathDescription text="" service=""/>
</Path>

<Path pathNumber="12" pathSet="107" connectionCode = "1881%1876" protocol="tcp">
<PathEndpoint type="begin" Id="1881">
	<IPRange first="10.36.2.0" last="10.37.0.255"/>
	<PortRange first="0" last="65535"/>
</PathEndpoint>
<PathEndpoint type="end" Id="1876">
	<IPRange first="10.39.1.22" last="10.39.1.22" include="1896"/>
	<PortRange first="22" last="22"/>
</PathEndpoint>
<PathPoint Id="1881">
</PathPoint>
<PathPoint Id="2028">
</PathPoint>
<PathPoint Id="1875">
</PathPoint>
<PathPoint Id="553" Ingress="outside" Egress="dmz">
	<PathRule sequence="r60"/>
	<PathRule sequence="15"/>
</PathPoint>
<PathPoint Id="1876">
</PathPoint>
<PathDescription text="" service=""/>
</Path>

<Path pathNumber="13" pathSet="107" connectionCode = "1881%1876" protocol="tcp">
<PathEndpoint type="begin" Id="1881">
	<IPRange first="10.37.2.0" last="10.38.0.255"/>
	<PortRange first="0" last="65535"/>
</PathEndpoint>
<PathEndpoint type="end" Id="1876">
	<IPRange first="10.39.1.22" last="10.39.1.22" include="1896"/>
	<PortRange first="22" last="22"/>
</PathEndpoint>
<PathPoint Id="1881">
</PathPoint>
<PathPoint Id="2028">
</PathPoint>
<PathPoint Id="1875">
</PathPoint>
<PathPoint Id="553" Ingress="outside" Egress="dmz">
	<PathRule sequence="r60"/>
	<PathRule sequence="15"/>
</PathPoint>
<PathPoint Id="1876">
</PathPoint>
<PathDescription text="" service=""/>
</Path>

<Path pathNumber="14" pathSet="107" connectionCode = "1881%1876" protocol="tcp">
<PathEndpoint type="begin" Id="1881">
	<IPRange first="10.38.2.0" last="10.39.0.255"/>
	<PortRange first="0" last="65535"/>
</PathEndpoint>
<PathEndpoint type="end" Id="1876">
	<IPRange first="10.39.1.22" last="10.39.1.22" include="1896"/>
	<PortRange first="22" last="22"/>
</PathEndpoint>
<PathPoint Id="1881">
</PathPoint>
<PathPoint Id="2028">
</PathPoint>
<PathPoint Id="1875">
</PathPoint>
<PathPoint Id="553" Ingress="outside" Egress="dmz">
	<PathRule sequence="r60"/>
	<PathRule sequence="15"/>
</PathPoint>
<PathPoint Id="1876">
</PathPoint>
<PathDescription text="" service=""/>
</Path>

<Path pathNumber="15" pathSet="107" connectionCode = "1881%1876" protocol="tcp">
<PathEndpoint type="begin" Id="1881">
	<IPRange first="10.39.2.0" last="70.32.128.21"/>
	<PortRange first="0" last="65535"/>
</PathEndpoint>
<PathEndpoint type="end" Id="1876">
	<IPRange first="10.39.1.22" last="10.39.1.22" include="1896"/>
	<PortRange first="22" last="22"/>
</PathEndpoint>
<PathPoint Id="1881">
</PathPoint>
<PathPoint Id="2028">
</PathPoint>
<PathPoint Id="1875">
</PathPoint>
<PathPoint Id="553" Ingress="outside" Egress="dmz">
	<PathRule sequence="r60"/>
	<PathRule sequence="15"/>
</PathPoint>
<PathPoint Id="1876">
</PathPoint>
<PathDescription text="" service=""/>
</Path>

<Path pathNumber="16" pathSet="107" connectionCode = "1881%1876" protocol="tcp">
<PathEndpoint type="begin" Id="1881">
	<IPRange first="192.18.0.0" last="255.255.255.255"/>
	<PortRange first="0" last="65535"/>
</PathEndpoint>
<PathEndpoint type="end" Id="1876">
	<IPRange first="10.39.1.22" last="10.39.1.22" include="1896"/>
	<PortRange first="22" last="22"/>
</PathEndpoint>
<PathPoint Id="1881">
</PathPoint>
<PathPoint Id="2028">
</PathPoint>
<PathPoint Id="1875">
</PathPoint>
<PathPoint Id="553" Ingress="outside" Egress="dmz">
	<PathRule sequence="r60"/>
	<PathRule sequence="15"/>
</PathPoint>
<PathPoint Id="1876">
</PathPoint>
<PathDescription text="" service=""/>
</Path>

<Path pathNumber="17" pathSet="107" connectionCode = "1882%1870" protocol="tcp">
<PathEndpoint type="begin" Id="1882">
	<IPRange first="70.32.128.22" last="70.32.128.22"/>
	<PortRange first="0" last="65535"/>
</PathEndpoint>
<PathEndpoint type="end" Id="1870">
	<IPRange first="10.33.1.250" last="10.33.1.250" include="1930"/>
	<PortRange first="22" last="22"/>
</PathEndpoint>
<PathPoint Id="1882">
</PathPoint>
<PathPoint Id="2028">
</PathPoint>
<PathPoint Id="1875">
</PathPoint>
<PathPoint Id="553" Ingress="outside" Egress="inside">
	<PathRule sequence="r15"/>
	<PathRule sequence="14"/>
</PathPoint>
<PathPoint Id="1868">
</PathPoint>
<PathPoint Id="1093" Ingress="outside" Egress="inside">
	<PathRule sequence="r66"/>
	<PathRule sequence="33"/>
</PathPoint>
<PathPoint Id="1870">
</PathPoint>
<PathDescription text="" service=""/>
</Path>

<Path pathNumber="18" pathSet="107" connectionCode = "1882%1870" protocol="tcp">
<PathEndpoint type="begin" Id="1882">
	<IPRange first="70.32.128.74" last="70.32.128.74"/>
	<PortRange first="0" last="65535"/>
</PathEndpoint>
<PathEndpoint type="end" Id="1870">
	<IPRange first="10.33.1.250" last="10.33.1.250" include="1930"/>
	<PortRange first="22" last="22"/>
</PathEndpoint>
<PathPoint Id="1882">
</PathPoint>
<PathPoint Id="2028">
</PathPoint>
<PathPoint Id="1875">
</PathPoint>
<PathPoint Id="553" Ingress="outside" Egress="inside">
	<PathRule sequence="r15"/>
	<PathRule sequence="14"/>
</PathPoint>
<PathPoint Id="1868">
</PathPoint>
<PathPoint Id="1093" Ingress="outside" Egress="inside">
	<PathRule sequence="r66"/>
	<PathRule sequence="33"/>
</PathPoint>
<PathPoint Id="1870">
</PathPoint>
<PathDescription text="" service=""/>
</Path>

<Path pathNumber="19" pathSet="107" connectionCode = "1882%1870" protocol="tcp">
<PathEndpoint type="begin" Id="1882">
	<IPRange first="70.32.128.171" last="70.32.128.171"/>
	<PortRange first="0" last="65535"/>
</PathEndpoint>
<PathEndpoint type="end" Id="1870">
	<IPRange first="10.33.1.250" last="10.33.1.250" include="1930"/>
	<PortRange first="22" last="22"/>
</PathEndpoint>
<PathPoint Id="1882">
</PathPoint>
<PathPoint Id="2028">
</PathPoint>
<PathPoint Id="1875">
</PathPoint>
<PathPoint Id="553" Ingress="outside" Egress="inside">
	<PathRule sequence="r15"/>
	<PathRule sequence="14"/>
</PathPoint>
<PathPoint Id="1868">
</PathPoint>
<PathPoint Id="1093" Ingress="outside" Egress="inside">
	<PathRule sequence="r66"/>
	<PathRule sequence="33"/>
</PathPoint>
<PathPoint Id="1870">
</PathPoint>
<PathDescription text="" service=""/>
</Path>

<Path pathNumber="20" pathSet="107" connectionCode = "1882%1871" protocol="tcp">
<PathEndpoint type="begin" Id="1882">
	<IPRange first="70.32.128.22" last="70.32.128.22"/>
	<PortRange first="0" last="65535"/>
</PathEndpoint>
<PathEndpoint type="end" Id="1871">
	<IPRange first="10.34.1.101" last="10.34.1.101" include="1938"/>
	<PortRange first="22" last="22"/>
</PathEndpoint>
<PathPoint Id="1882">
</PathPoint>
<PathPoint Id="2028">
</PathPoint>
<PathPoint Id="1875">
</PathPoint>
<PathPoint Id="553" Ingress="outside" Egress="inside">
	<PathRule sequence="r16"/>
	<PathRule sequence="14"/>
</PathPoint>
<PathPoint Id="1868">
</PathPoint>
<PathPoint Id="1267" Ingress="outside" Egress="inside">
	<PathRule sequence="r68"/>
	<PathRule sequence="41"/>
</PathPoint>
<PathPoint Id="1871">
</PathPoint>
<PathDescription text="" service=""/>
</Path>

<Path pathNumber="21" pathSet="107" connectionCode = "1882%1871" protocol="tcp">
<PathEndpoint type="begin" Id="1882">
	<IPRange first="70.32.128.22" last="70.32.128.22"/>
	<PortRange first="0" last="65535"/>
</PathEndpoint>
<PathEndpoint type="end" Id="1871">
	<IPRange first="10.34.1.102" last="10.34.1.102" include="1940"/>
	<PortRange first="22" last="22"/>
</PathEndpoint>
<PathPoint Id="1882">
</PathPoint>
<PathPoint Id="2028">
</PathPoint>
<PathPoint Id="1875">
</PathPoint>
<PathPoint Id="553" Ingress="outside" Egress="inside">
	<PathRule sequence="r16"/>
	<PathRule sequence="14"/>
</PathPoint>
<PathPoint Id="1868">
</PathPoint>
<PathPoint Id="1267" Ingress="outside" Egress="inside">
	<PathRule sequence="r68"/>
	<PathRule sequence="41"/>
</PathPoint>
<PathPoint Id="1871">
</PathPoint>
<PathDescription text="" service=""/>
</Path>

<Path pathNumber="22" pathSet="107" connectionCode = "1882%1871" protocol="tcp">
<PathEndpoint type="begin" Id="1882">
	<IPRange first="70.32.128.22" last="70.32.128.22"/>
	<PortRange first="0" last="65535"/>
</PathEndpoint>
<PathEndpoint type="end" Id="1871">
	<IPRange first="10.34.1.103" last="10.34.1.103" include="1942"/>
	<PortRange first="22" last="22"/>
</PathEndpoint>
<PathPoint Id="1882">
</PathPoint>
<PathPoint Id="2028">
</PathPoint>
<PathPoint Id="1875">
</PathPoint>
<PathPoint Id="553" Ingress="outside" Egress="inside">
	<PathRule sequence="r16"/>
	<PathRule sequence="14"/>
</PathPoint>
<PathPoint Id="1868">
</PathPoint>
<PathPoint Id="1267" Ingress="outside" Egress="inside">
	<PathRule sequence="r68"/>
	<PathRule sequence="41"/>
</PathPoint>
<PathPoint Id="1871">
</PathPoint>
<PathDescription text="" service=""/>
</Path>

<Path pathNumber="23" pathSet="107" connectionCode = "1882%1871" protocol="tcp">
<PathEndpoint type="begin" Id="1882">
	<IPRange first="70.32.128.22" last="70.32.128.22"/>
	<PortRange first="0" last="65535"/>
</PathEndpoint>
<PathEndpoint type="end" Id="1871">
	<IPRange first="10.34.1.201" last="10.34.1.201" include="1934"/>
	<PortRange first="22" last="22"/>
</PathEndpoint>
<PathPoint Id="1882">
</PathPoint>
<PathPoint Id="2028">
</PathPoint>
<PathPoint Id="1875">
</PathPoint>
<PathPoint Id="553" Ingress="outside" Egress="inside">
	<PathRule sequence="r16"/>
	<PathRule sequence="14"/>
</PathPoint>
<PathPoint Id="1868">
</PathPoint>
<PathPoint Id="1267" Ingress="outside" Egress="inside">
	<PathRule sequence="r68"/>
	<PathRule sequence="41"/>
</PathPoint>
<PathPoint Id="1871">
</PathPoint>
<PathDescription text="" service=""/>
</Path>

<Path pathNumber="24" pathSet="107" connectionCode = "1882%1871" protocol="tcp">
<PathEndpoint type="begin" Id="1882">
	<IPRange first="70.32.128.22" last="70.32.128.22"/>
	<PortRange first="0" last="65535"/>
</PathEndpoint>
<PathEndpoint type="end" Id="1871">
	<IPRange first="10.34.1.202" last="10.34.1.202" include="1936"/>
	<PortRange first="22" last="22"/>
</PathEndpoint>
<PathPoint Id="1882">
</PathPoint>
<PathPoint Id="2028">
</PathPoint>
<PathPoint Id="1875">
</PathPoint>
<PathPoint Id="553" Ingress="outside" Egress="inside">
	<PathRule sequence="r16"/>
	<PathRule sequence="14"/>
</PathPoint>
<PathPoint Id="1868">
</PathPoint>
<PathPoint Id="1267" Ingress="outside" Egress="inside">
	<PathRule sequence="r68"/>
	<PathRule sequence="41"/>
</PathPoint>
<PathPoint Id="1871">
</PathPoint>
<PathDescription text="" service=""/>
</Path>

<Path pathNumber="25" pathSet="107" connectionCode = "1882%1871" protocol="tcp">
<PathEndpoint type="begin" Id="1882">
	<IPRange first="70.32.128.22" last="70.32.128.22"/>
	<PortRange first="0" last="65535"/>
</PathEndpoint>
<PathEndpoint type="end" Id="1871">
	<IPRange first="10.34.1.250" last="10.34.1.250" include="1932"/>
	<PortRange first="22" last="22"/>
</PathEndpoint>
<PathPoint Id="1882">
</PathPoint>
<PathPoint Id="2028">
</PathPoint>
<PathPoint Id="1875">
</PathPoint>
<PathPoint Id="553" Ingress="outside" Egress="inside">
	<PathRule sequence="r16"/>
	<PathRule sequence="14"/>
</PathPoint>
<PathPoint Id="1868">
</PathPoint>
<PathPoint Id="1267" Ingress="outside" Egress="inside">
	<PathRule sequence="r68"/>
	<PathRule sequence="41"/>
</PathPoint>
<PathPoint Id="1871">
</PathPoint>
<PathDescription text="" service=""/>
</Path>

<Path pathNumber="26" pathSet="107" connectionCode = "1882%1871" protocol="tcp">
<PathEndpoint type="begin" Id="1882">
	<IPRange first="70.32.128.74" last="70.32.128.74"/>
	<PortRange first="0" last="65535"/>
</PathEndpoint>
<PathEndpoint type="end" Id="1871">
	<IPRange first="10.34.1.101" last="10.34.1.101" include="1938"/>
	<PortRange first="22" last="22"/>
</PathEndpoint>
<PathPoint Id="1882">
</PathPoint>
<PathPoint Id="2028">
</PathPoint>
<PathPoint Id="1875">
</PathPoint>
<PathPoint Id="553" Ingress="outside" Egress="inside">
	<PathRule sequence="r16"/>
	<PathRule sequence="14"/>
</PathPoint>
<PathPoint Id="1868">
</PathPoint>
<PathPoint Id="1267" Ingress="outside" Egress="inside">
	<PathRule sequence="r68"/>
	<PathRule sequence="41"/>
</PathPoint>
<PathPoint Id="1871">
</PathPoint>
<PathDescription text="" service=""/>
</Path>

<Path pathNumber="27" pathSet="107" connectionCode = "1882%1871" protocol="tcp">
<PathEndpoint type="begin" Id="1882">
	<IPRange first="70.32.128.74" last="70.32.128.74"/>
	<PortRange first="0" last="65535"/>
</PathEndpoint>
<PathEndpoint type="end" Id="1871">
	<IPRange first="10.34.1.102" last="10.34.1.102" include="1940"/>
	<PortRange first="22" last="22"/>
</PathEndpoint>
<PathPoint Id="1882">
</PathPoint>
<PathPoint Id="2028">
</PathPoint>
<PathPoint Id="1875">
</PathPoint>
<PathPoint Id="553" Ingress="outside" Egress="inside">
	<PathRule sequence="r16"/>
	<PathRule sequence="14"/>
</PathPoint>
<PathPoint Id="1868">
</PathPoint>
<PathPoint Id="1267" Ingress="outside" Egress="inside">
	<PathRule sequence="r68"/>
	<PathRule sequence="41"/>
</PathPoint>
<PathPoint Id="1871">
</PathPoint>
<PathDescription text="" service=""/>
</Path>

<Path pathNumber="28" pathSet="107" connectionCode = "1882%1871" protocol="tcp">
<PathEndpoint type="begin" Id="1882">
	<IPRange first="70.32.128.74" last="70.32.128.74"/>
	<PortRange first="0" last="65535"/>
</PathEndpoint>
<PathEndpoint type="end" Id="1871">
	<IPRange first="10.34.1.103" last="10.34.1.103" include="1942"/>
	<PortRange first="22" last="22"/>
</PathEndpoint>
<PathPoint Id="1882">
</PathPoint>
<PathPoint Id="2028">
</PathPoint>
<PathPoint Id="1875">
</PathPoint>
<PathPoint Id="553" Ingress="outside" Egress="inside">
	<PathRule sequence="r16"/>
	<PathRule sequence="14"/>
</PathPoint>
<PathPoint Id="1868">
</PathPoint>
<PathPoint Id="1267" Ingress="outside" Egress="inside">
	<PathRule sequence="r68"/>
	<PathRule sequence="41"/>
</PathPoint>
<PathPoint Id="1871">
</PathPoint>
<PathDescription text="" service=""/>
</Path>

<Path pathNumber="29" pathSet="107" connectionCode = "1882%1871" protocol="tcp">
<PathEndpoint type="begin" Id="1882">
	<IPRange first="70.32.128.74" last="70.32.128.74"/>
	<PortRange first="0" last="65535"/>
</PathEndpoint>
<PathEndpoint type="end" Id="1871">
	<IPRange first="10.34.1.201" last="10.34.1.201" include="1934"/>
	<PortRange first="22" last="22"/>
</PathEndpoint>
<PathPoint Id="1882">
</PathPoint>
<PathPoint Id="2028">
</PathPoint>
<PathPoint Id="1875">
</PathPoint>